{
  "$schema": "https://json-schema.org/draft/2020-12/schema",
  "type": "object",
  "required": [
    "_id",
    "assignmentId",
    "grade",
    "submissionId",
    "submittedAt",
    "userId"
  ],
  "properties": {
    "_id": {
      "$ref": "#/$defs/ObjectId"
    },
    "assignmentId": {
      "type": "string"
    },
    "grade": {
      "type": "integer"
    },
    "submissionId": {
      "type": "string"
    },
    "submittedAt": {
      "$ref": "#/$defs/Date"
    },
    "userId": {
      "type": "string"
    }
  },
  "$defs": {
    "ObjectId": {
      "type": "object",
      "properties": {
        "$oid": {
          "type": "string",
          "pattern": "^[0-9a-fA-F]{24}$"
        }
      },
      "required": [
        "$oid"
      ],
      "additionalProperties": false
    },
    "Date": {
      "type": "object",
      "properties": {
        "$date": {
          "type": "string",
          "format": "date-time"
        }
      },
      "required": [
        "$date"
      ],
      "additionalProperties": false
    }
  }
}